{
  "name": "get-design-done",
  "short_name": "gdd",
  "version": "1.34.4",
  "description": "Agent-orchestrated 5-stage design pipeline: Brief → Explore → Plan → Design → Verify. 22+ specialized agents, 9 connections (Figma, Refero, Preview, Storybook, Chromatic, Figma Writer, Graphify, Pinterest, Claude Design), handoff-first workflow via Claude Design bundles, bidirectional Figma write-back (annotations, Code Connect), queryable intel store (`.design/intel/`) for O(1) design surface lookups, and self-improvement loop (reflector agent, frontmatter + budget feedback, global-skills layer at `~/.claude/gdd/global-skills/`). Standalone commands: style, darkmode, compare, figma-write, graphify, handoff, analyze-dependencies, skill-manifest, extract-learnings, reflect, apply-reflections. Embeds NNG heuristics, WCAG thresholds, typographic systems, motion framework, and anti-pattern catalog. Ships with a full CI/CD pipeline (Node 22/24 × Linux/macOS/Windows, lint + schema + frontmatter + stale-ref + shellcheck + gitleaks + injection-scan + blocking size-budget) and release automation (auto-tag + GitHub Release + release-time smoke test). Optimization layer (v1.0.4.1, retroactive): gdd-router + gdd-cache-manager skills, PreToolUse budget-enforcer hook, tier-aware agent frontmatter, lazy checker gates, streaming synthesizer, /gdd:warm-cache + /gdd:optimize commands, and cost telemetry at .design/telemetry/costs.jsonl — targeting 50-70% per-task token-cost reduction with no quality-floor regression. v1.20.0 SDK foundation: gdd-state MCP server (11 typed tools), lockfile-safe STATE.md mutations, event stream at .design/telemetry/events.jsonl, resilience primitives (jittered-backoff, rate-guard, error-classifier, iteration-budget) with rate-limit + 429 + context-overflow recovery, and TypeScript toolchain. v1.27.7 ships gdd-mcp (Phase 27.7): 12 read-only MCP tools for sub-3s priming. v1.28.0 (Phase 28): Foundational References Tier 2 — 5 new reference files (color-theory, composition, proportion-systems, i18n, contrast-advanced), 2 verifier i18n probes + 1 explore i18n-readiness probe, 12 additive cross-link insertions across 10 existing references, 2 orthogonal audit-scoring lens-tags (composition_alignment + i18n_readiness).",
  "author": {
    "name": "hegemonart",
    "url": "https://github.com/hegemonart"
  },
  "homepage": "https://github.com/hegemonart/get-design-done",
  "repository": "https://github.com/hegemonart/get-design-done",
  "license": "MIT",
  "keywords": [
    "design",
    "ui",
    "ux",
    "frontend",
    "pipeline",
    "skill",
    "design-system",
    "accessibility",
    "wcag",
    "nng",
    "typography",
    "motion",
    "anti-patterns",
    "audit",
    "visual-regression",
    "storybook",
    "graphify",
    "playwright",
    "figma-write",
    "handoff",
    "claude-design",
    "pinterest",
    "bidirectional",
    "knowledge-graph",
    "intel-store",
    "self-improvement",
    "reflection",
    "safety-hardening",
    "protected-paths",
    "decision-injector",
    "reference-registry",
    "mcp-circuit-breaker",
    "tested",
    "ci",
    "cicd",
    "release-automation",
    "gitleaks",
    "shellcheck",
    "schema-validation",
    "cost-optimization",
    "cache-aware",
    "budget",
    "headless",
    "cli",
    "codex",
    "gemini",
    "mcp",
    "parallel-agents",
    "agent-sdk",
    "mcp-server",
    "context-loading",
    "cross-session",
    "figma",
    "extractor",
    "design-system-sync",
    "swift",
    "compose",
    "flutter",
    "email",
    "print",
    "pdf"
  ],
  "skills": [
    "./skills/"
  ]
}
